<?xml version="1.0" encoding="UTF-8"?>
<!DOCTYPE i18n SYSTEM "../../include/dtd/i18n.dtd">
<i18n xams-release="0.0.19" file-release="0.1.0" file-revision="1" date="2008-12-03">
    <lngspec name="french" iso="fr" localname="french"/>
    <maintainers>
        <maintainer>
            <name>ACTION-WEB</name>
            <email>xams@actionweb.fr</email>
        </maintainer>
    </maintainers>
    <msgs>
        <title id="User Template Management">Administration des gabarits utilisateur</title>
        <msg id="User-Templates Management">Administration des gabarits utilisateur</msg>
        <msg id="Template-Name">Nom du gabarit</msg>
        <msg id="Username">Nom du compte (E-Mail)</msg>
        <msg id="Password">Mot de passe</msg>
        <msg id="Quota">Quota</msg>
        <msg id="Type">Protocole</msg>
        <msg id="Viruscheck (Incoming)">Anti-Virus (Entrant)</msg>
        <msg id="Viruscheck (Outgoing)">Anti-Virus (Sortant)</msg>
        <msg id="Spamcheck (Incoming)">Anti-SPAM (Entrant)</msg>
        <msg id="Spamcheck (Outgoing)">Anti-SPAM (Sortant)</msg>
        <msg id="Spam Score Trigger">Réglage des scores de Spam</msg>
        <msg id="Spam Score">Score de base </msg>
        <msg id="High Spam Score">Score limite </msg>
        <msg id="Site dependent">Dépendant du site</msg>
        <msg id="Relay on auth">Relais sur autorisation</msg>
        <msg id="Relay on check">Relais sur vérification</msg>
        <msg id="Template created">Gabarit créé le</msg>
        <msg id="Template last updated">Gabarit mis à jour le</msg>

        <!-- Status-Meldungen -->
        <msg id="User-Template '%s' was added successfully.">Le gabarit utilisateur '%s' a été ajouté avec succès.</msg>
        <msg id="User-Template '%s' was updated successfully.">Le gabarit utilisateur '%s' a été mis à jour avec succès.</msg>
        <msg id="User-Template '%s' was deleted successfully.">Le gabarit utilisateur '%s' a été effacé avec succès.</msg>
        <msg id="User-Template '%s' could not be added.">Le gabarit utilisateur '%s' n'a pas pu être ajouté.</msg>
        <msg id="User-Template '%s' could not be updated.">Le gabarit utilisateur '%s' n'a pas pu être mis à jour.</msg>
        <msg id="User-Template '%s' could not be deleted.">Le gabarit utilisateur '%s' n'a pas pu être effacé.</msg>
    </msgs>
</i18n>
