<?xml version="1.0" encoding="UTF-8"?>
<!DOCTYPE i18n SYSTEM "../../include/dtd/i18n.dtd">
<i18n xams-release="0.0.16" file-release="0.1.0" file-revision="1" date="2006-10-21">
    <lngspec name="french" iso="fr" localname="french"/>
    <maintainers>
        <maintainer>
            <name>ACTION-WEB</name>
            <email>xams@actionweb.fr</email>
        </maintainer>
    </maintainers>
    <msgs>
        <title id="Exim-Filter Configuration">Configuration du filtre d'Exim</title>
        <msg id="Exim-Filter Configuration">Configuration du filtre d'Exim</msg>
        <msg id="Filter">Filtre</msg>
        <msg id="Active">Actif</msg>
        <msg id="Filter created">Filtre créé</msg>
        <msg id="Filter last updated">Filtre mis à jour le</msg>

        <!-- Status-Meldungen -->
        <msg id="Filter for User '%s' was added successfully.">Le filtre de l'utilisateur '%s' a été créé avec succès.</msg>
        <msg id="Filter for User '%s' was updated successfully.">Le filtre de l'utilisateur '%s' a été mis à jour avec succès.</msg>
        <msg id="Filter for User '%s' was deleted successfully.">Le filtre de l'utilisateur '%s' a été effacé avec succès.</msg>
        <msg id="Filter for User '%s' could not be added.">Le filtre de l'utilisateur '%s' n'a pas pu être ajouté.</msg>
        <msg id="Filter for User '%s' could not be updated.">Le filtre de l'utilisateur '%s' n'a pas pu être mis à jour.</msg>
        <msg id="Filter for User '%s' could not be deleted.">Le filtre de l'utilisateur '%s' n'a pas pu être effacé.</msg>
    </msgs>
</i18n>