<?xml version="1.0" encoding="UTF-8"?>
<!DOCTYPE i18n SYSTEM "../../include/dtd/i18n.dtd">
<i18n xams-release="0.0.15" file-release="0.0.9" file-revision="1" date="2004-02-12">
    <lngspec name="german" iso="de" localname="deutsch"/>
    <maintainers>
        <maintainer>
            <name>XAMS Core-Team</name>
            <email>info@xams.org</email>
        </maintainer>
    </maintainers>
    <msgs>
        <title id="Addressbook Management">Adressbuch Verwaltung</title>
        <msg id="Site Addressbook Administration">Site-Adressbuch Verwaltung</msg>
        <msg id="User Addressbook Administration">Benutzer-Adressbuch Verwaltung</msg>
        <msg id="Alias Addressbook Administration">Alias-Adressbuch Verwaltung</msg>
        <msg id="Reseller Addressbook Administration">Wiederverkäufer-Adressbuch Verwaltung</msg>
        <msg id="Customer Addressbook Administration">Endkunden-Adressbuch Verwaltung</msg>
        <msg id="Fieldname">Feldname</msg>
        <msg id="LDAP">LDAP</msg>
        <msg id="ACL Reseller">ACL Wiederverkäufer</msg>
        <msg id="ACL Customer">ACL Endkunde</msg>
        <msg id="ACL User">ACL Benutzer</msg>
        <msg id="Move field">Feld verschieben</msg>
        <msg id="None">Nichts</msg>
        <msg id="Read">Lesen</msg>
        <msg id="Read+Write">Lesen+Schreiben</msg>
        <msg id="Add new field to Addressbook">Neues Feld in das Adressbuch hinzufügen</msg>
        <msg id="Sites" />
        <msg id="Users">Benutzer</msg>
        <msg id="Aliases">Aliase</msg>
        <msg id="Resellers">Wiederverkäufer</msg>
        <msg id="Customers">Endkunden</msg>
        <msg id="No addressbook fields found.">Keine Adressbuch-Einträge gefunden.</msg>
    </msgs>
</i18n>