<?xml version="1.0" encoding="UTF-8"?>
<!DOCTYPE i18n SYSTEM "../../include/dtd/i18n.dtd">
<i18n xams-release="0.0.9" file-release="0.0.9" file-revision="1" date="2002-11-29">
    <lngspec name="english" iso="en" localname="english"/>
    <maintainers>
        <maintainer>
            <name>XAMS Core-Team</name>
            <email>info@xams.org</email>
        </maintainer>
    </maintainers>    
    <msgs>
        <title id="Exim-Filter Configuration" />
        <msg id="Exim Filter Configuration" />
        <msg id="Filter" />
        <msg id="Active" />
        <msg id="Filter created" />
        <msg id="Filter last updated" />

        <!-- Status messages -->
        <msg id="Filter for User '%s' was added successfully." />
        <msg id="Filter for User '%s' was updated successfully." />
        <msg id="Filter for User '%s' was deleted successfully." />
        <msg id="Filter for User '%s' could not be added." />
        <msg id="Filter for User '%s' could not be updated." />
        <msg id="Filter for User '%s' could not be deleted." />
    </msgs>
</i18n>