<?xml version="1.0" encoding="UTF-8"?>
<!DOCTYPE i18n SYSTEM "../../include/dtd/i18n.dtd">
<i18n xams-release="0.0.19" file-release="0.0.1" file-revision="1" date="2009-04-02">
    <lngspec name="english" iso="en" localname="english"/>
    <maintainers>
        <maintainer>
            <name>XAMS Core-Team</name>
            <email>info@xams.org</email>
        </maintainer>
    </maintainers>
    <msgs>
        <title id="System Overview">System Übersicht</title>
        <msg id="System Overview">System Übersicht</msg>
        <msg id="Reseller">Wiederverkäufer</msg>
        <msg id="Site">Site</msg>
        <msg id="Add User">Benutzer hinzufügen</msg>
        <msg id="Add Alias">Alias hinzufügen</msg>
        <msg id="Actions">Aktionen</msg>
        <msg id="Show all Sites">Alle Sites anzeigen</msg>
    </msgs>
</i18n>
