<?xml version="1.0" encoding="UTF-8"?>
<!DOCTYPE i18n SYSTEM "../../include/dtd/i18n.dtd">
<i18n xams-release="0.0.9" file-release="0.0.9" file-revision="1" date="2002-11-29">
    <lngspec name="german" iso="de" localname="deutsch"/>
    <maintainers>
        <maintainer>
            <name>XAMS Core-Team</name>
            <email>info@xams.org</email>
        </maintainer>
    </maintainers>    
    <msgs>
        <title id="Exim-Filter Configuration">Exim-Filter Konfiguration</title>
        <msg id="Exim-Filter Configuration">Exim-Filter Konfiguration</msg>
        <msg id="Filter" />
        <msg id="Active">Aktiv</msg>
        <msg id="Filter created">Filter angelegt</msg>
        <msg id="Filter last updated">Filter zuletzt aktualisiert</msg>

        <!-- Status-Meldungen -->
        <msg id="Filter for User '%s' was added successfully.">Der Filter für den Benutzer '%s' wurde erfolgreich hinzugefügt.</msg>
        <msg id="Filter for User '%s' was updated successfully.">Der Filter für den Benutzer '%s' wurde erfolgreich aktualisiert.</msg>
        <msg id="Filter for User '%s' was deleted successfully.">Der Filter für den Benutzer '%s' wurde erfolgreich gelöscht.</msg>
        <msg id="Filter for User '%s' could not be added.">Der Filter für den Benutzer '%s' konnte nicht hinzugefügt werden.</msg>
        <msg id="Filter for User '%s' could not be updated.">Der Filter für den Benutzer '%s' konnte nicht aktualisiert werden.</msg>
        <msg id="Filter for User '%s' could not be deleted.">Der Filter für den Benutzer '%s' konnte nicht gelöscht werden.</msg>
    </msgs>
</i18n>